{
  "reviewVersion": "1.2",
  "schemaVersion": "1.2",
  "generatedAt": "2026-07-21T12:00:00Z",
  "sourceId": "efsa.openfoodtox",
  "sourceDoi": "10.5281/zenodo.19388272",
  "sourceVersion": "v7",
  "sourcePublishedAt": "2026-04-30",
  "sourceFile": "OFT3.0 export repository.xlsx",
  "sourceFileSha256": "5181661e921651d4087b544981e1e5a63b99532844eac0112732806a00a85eda",
  "workbookSchemaSha256": "cfa197b4b57a2517eebaac67938601a07137e44942de3ee11194bc477474ac10",
  "statusDefinitions": {
    "supportStatus": {
      "exact_supported_structured": "Exact value and unit are present in a structured source field.",
      "exact_supported_unstructured": "Exact value is present in a source narrative and was parsed with the strict narrative grammar.",
      "supported_after_unit_normalization": "Value is exact after a semantics-preserving unit normalization.",
      "supported_after_primary_source_unit_correction": "Value is supported after correcting a dataset unit against the authoritative scientific output while preserving the raw encoding.",
      "supported_but_source_encoding_anomalous": "Value is supported, but the source bound field is not the expected HBGV encoding.",
      "conflicting_values": "Cross-sheet candidates exist but none supports the curated assertion.",
      "not_found_after_cross_sheet_search": "No matching candidate was found across both reviewed sheets.",
      "original_output_overrides_dataset": "The original scientific output was adjudicated as authoritative over a dataset difference."
    },
    "temporalStatus": {
      "current": "Current curated assertion.",
      "historical": "Earlier assertion retained as history.",
      "currentness_uncertain": "Currentness cannot be resolved from the dataset alone."
    }
  },
  "recordCount": 16,
  "supportStatusCounts": {
    "exact_supported_structured": 6,
    "exact_supported_unstructured": 2,
    "supported_after_primary_source_unit_correction": 3,
    "supported_after_unit_normalization": 4,
    "supported_but_source_encoding_anomalous": 1
  },
  "temporalStatusCounts": {
    "current": 16
  },
  "records": [
    {
      "curatedRecordId": "efsa.acrylamide.neoplastic.bmdl10",
      "substanceKey": "acrylamide",
      "referenceType": "bmdl10_neoplastic",
      "curatedValue": 0.17,
      "curatedUnit": "mg/kg bw/day",
      "curatedSourceIds": [
        "efsa.acrylamide.food.2015"
      ],
      "assertionClass": "reference_point",
      "assertionStatus": "selected_reference_point",
      "regulatoryAdoptionStatus": null,
      "temporalStatus": "current",
      "validFrom": "2015-06-04",
      "assessmentYear": null,
      "introducedBySourceIds": [
        "efsa.acrylamide.food.2015"
      ],
      "supportingSourceIds": [
        "efsa.acrylamide.food.2015"
      ],
      "databaseSourceIds": [
        "efsa.openfoodtox"
      ],
      "regulatoryFollowUpSourceIds": [],
      "supersedesRecordIds": [],
      "supportStatus": "exact_supported_structured",
      "openfoodtox3Candidates": [
        {
          "recordKey": "0e049a9f-368c-40c0-b15c-6d2672fdc059#row-36872",
          "sourceFile": "OFT3.0 export repository.xlsx",
          "sourceSheet": "END_STUDY_REC.HumanHealth",
          "sourceRowNumber": 36872,
          "documentUuid": "0e049a9f-368c-40c0-b15c-6d2672fdc059",
          "substanceUuid": "e6f2726e-2e3b-49c4-849b-a409330e14c8",
          "referenceSubstanceUuid": "809b574b-001a-4ed7-974c-901664b06d36",
          "casNumber": "79-06-1",
          "ecNumber": "201-173-7",
          "assertionClass": "reference_point",
          "sourceEncoding": "structured",
          "sourceEncodingFlags": [],
          "descriptor": "BMDL10",
          "descriptorFieldPath": "ResultsAndDiscussion.EffectLevels.Efflevel.Endpoint",
          "bound": "lower",
          "sourceFieldPath": "ResultsAndDiscussion.EffectLevels.Efflevel.EffectLevel.lowerValue",
          "sourceUnitFieldPath": "ResultsAndDiscussion.EffectLevels.Efflevel.EffectLevel.Unit",
          "sourceQualifierFieldPath": null,
          "rawValue": 0.17,
          "rawUnit": "mg/kg bw/day",
          "rawUnitSelector": "mg/kg bw/day",
          "rawQualifier": null,
          "normalizedValue": 0.17,
          "normalizedUnit": "mg/kg bw/day",
          "unitCorrection": null,
          "population": "humans",
          "assessmentYears": [
            2015
          ],
          "relationshipToCurated": "exact_match",
          "temporalStatus": "current",
          "assertionStatus": "selected_reference_point",
          "introducedBy": [
            {
              "sourceId": "efsa.acrylamide.food.2015",
              "doi": "10.2903/j.efsa.2015.4104",
              "dossierUuid": "c9486b75-3c8d-440d-85ea-eb4f8b1e0dca",
              "literatureUuid": null,
              "title": "Scientific Opinion on acrylamide in food",
              "assessmentDate": "2015-04-30"
            }
          ],
          "mentionedIn": [],
          "dossierMembership": [
            {
              "sourceId": "efsa.acrylamide.food.2015",
              "doi": "10.2903/j.efsa.2015.4104",
              "dossierUuid": "c9486b75-3c8d-440d-85ea-eb4f8b1e0dca",
              "literatureUuid": null,
              "title": "Scientific Opinion on acrylamide in food",
              "assessmentDate": "2015-04-30"
            }
          ],
          "supersedesRecordKeys": [],
          "supersededByRecordKeys": [],
          "effectContext": {
            "ResultsAndDiscussion.EffectLevels.Efflevel.Basis": "histopathology: neoplastic",
            "ResultsAndDiscussion.EffectLevels.Efflevel.Endpoint": "BMDL10",
            "ResultsAndDiscussion.EffectLevels.Efflevel.RemarksOnResults": "other:",
            "ResultsAndDiscussion.EffectLevels.Efflevel.RemarksOnResults.Other": "Toxicity: endocrine; Target tissue: Adrenal Glands; Effect desc.: Effect: incidences of Harderian gland adenomas and adenocarcinomas",
            "ResultsAndDiscussion.EffectLevels.Efflevel.RemarksOnResults.Remarks": "Remarks: Study: NTP 2012"
          },
          "rawNarrative": null
        }
      ]
    },
    {
      "curatedRecordId": "efsa.acrylamide.neurotoxicity.bmdl10",
      "substanceKey": "acrylamide",
      "referenceType": "bmdl10_neurotoxicity",
      "curatedValue": 0.43,
      "curatedUnit": "mg/kg bw/day",
      "curatedSourceIds": [
        "efsa.acrylamide.food.2015"
      ],
      "assertionClass": "reference_point",
      "assertionStatus": "selected_reference_point",
      "regulatoryAdoptionStatus": null,
      "temporalStatus": "current",
      "validFrom": "2015-06-04",
      "assessmentYear": null,
      "introducedBySourceIds": [
        "efsa.acrylamide.food.2015"
      ],
      "supportingSourceIds": [
        "efsa.acrylamide.food.2015"
      ],
      "databaseSourceIds": [
        "efsa.openfoodtox"
      ],
      "regulatoryFollowUpSourceIds": [],
      "supersedesRecordIds": [],
      "supportStatus": "exact_supported_structured",
      "openfoodtox3Candidates": [
        {
          "recordKey": "3156ca56-59c3-46c9-8580-8379497cd7de#row-35202",
          "sourceFile": "OFT3.0 export repository.xlsx",
          "sourceSheet": "END_STUDY_REC.HumanHealth",
          "sourceRowNumber": 35202,
          "documentUuid": "3156ca56-59c3-46c9-8580-8379497cd7de",
          "substanceUuid": "e6f2726e-2e3b-49c4-849b-a409330e14c8",
          "referenceSubstanceUuid": "809b574b-001a-4ed7-974c-901664b06d36",
          "casNumber": "79-06-1",
          "ecNumber": "201-173-7",
          "assertionClass": "reference_point",
          "sourceEncoding": "structured",
          "sourceEncodingFlags": [],
          "descriptor": "BMDL10",
          "descriptorFieldPath": "ResultsAndDiscussion.EffectLevels.Efflevel.Endpoint",
          "bound": "lower",
          "sourceFieldPath": "ResultsAndDiscussion.EffectLevels.Efflevel.EffectLevel.lowerValue",
          "sourceUnitFieldPath": "ResultsAndDiscussion.EffectLevels.Efflevel.EffectLevel.Unit.Other",
          "sourceQualifierFieldPath": null,
          "rawValue": 0.43,
          "rawUnit": "mg/kg bw/day",
          "rawUnitSelector": "other:",
          "rawQualifier": null,
          "normalizedValue": 0.43,
          "normalizedUnit": "mg/kg bw/day",
          "unitCorrection": null,
          "population": "humans",
          "assessmentYears": [
            2015
          ],
          "relationshipToCurated": "exact_match",
          "temporalStatus": "current",
          "assertionStatus": "selected_reference_point",
          "introducedBy": [
            {
              "sourceId": "efsa.acrylamide.food.2015",
              "doi": "10.2903/j.efsa.2015.4104",
              "dossierUuid": "c9486b75-3c8d-440d-85ea-eb4f8b1e0dca",
              "literatureUuid": null,
              "title": "Scientific Opinion on acrylamide in food",
              "assessmentDate": "2015-04-30"
            }
          ],
          "mentionedIn": [],
          "dossierMembership": [
            {
              "sourceId": "efsa.acrylamide.food.2015",
              "doi": "10.2903/j.efsa.2015.4104",
              "dossierUuid": "c9486b75-3c8d-440d-85ea-eb4f8b1e0dca",
              "literatureUuid": null,
              "title": "Scientific Opinion on acrylamide in food",
              "assessmentDate": "2015-04-30"
            }
          ],
          "supersedesRecordKeys": [],
          "supersededByRecordKeys": [],
          "effectContext": {
            "ResultsAndDiscussion.EffectLevels.Efflevel.Basis": "histopathology: non-neoplastic",
            "ResultsAndDiscussion.EffectLevels.Efflevel.Endpoint": "BMDL10",
            "ResultsAndDiscussion.EffectLevels.Efflevel.RemarksOnResults": "other:",
            "ResultsAndDiscussion.EffectLevels.Efflevel.RemarksOnResults.Other": "Toxicity: neurotoxicity; Target tissue: Periphreal Nerve; Effect desc.: Effect: incidences of peripheral nerve (sciatic) axonal degeneration",